구분	유저							
입학홍보	소마고는 어떤 곳 인가요?				"저희 부산 소프트웨어 마이스터고를 소개 합니다. 4차 산업혁명 핵심기술의 근간은 ‘SW’로 글로벌 시장은 SW인재 중심으로 급속히 재편 중이며, 기업에서도 SW인재 개발 분야를 지원, 학력 불문한 SW영재양성을 필요로 하고 있습니다."			
질의응답	학교에 체육시설이 있나요?				"운동장, 헬스장, 체육관이 마련되어 있음."			
질의응답	학교를 오기 전 어떤 공부를 해야 하나요?				"c언어, HTML, CSS등과 같은 기본 적인 역량을 길러 보세요!"			
질의응답	빨래 할 수 있나요?				빨래를 하기 위해서 세탁기를 사용할 수 있습니다.			
질의응답	아침운동 있나요?				아침 운동을 06:30부터 시작되어 07:00쯤메 종료 됩니다.			
일반대화	배고파요.				밥을 드세요.			
입학홍보	소마고는 어떤 가치를 추구하나요?				"부산소프트웨어마이스터고등학교에서는?모든 산업의 근간이 되는 소프트웨어 학습을 통해?사람과 생활에 유익한 소프트웨어를 개발하도록 교육과정을 운영하고?소통Communication,?배려Consideration,?협업Cooperation,?창의성Creativity으로 기계적?시스템을?이용해?새로운 가치를 만들어 내고 이를 공유하여?세상을 이롭게 하는?하이브리드형 인재를 양성하여?SW?분야의 창의·융합형?영 마이스터로?성장하도록?적극 지원할 것입니다."			
질의응답	졸업한뒤 어떤 일을 하나요?				대부분 개발자가 됩니다. 원한다면 다른 진로를 선택할 수 있습니다.			
